{
  "$schema": "../../schemas/runtime-vector-v1.schema.json",
  "schema_version": 1,
  "contract": "plenora-runtime-vector-v1",
  "kind": "request",
  "content_type": "application/json",
  "metadata": {
    "plenora.capability.name": "plenora.database-tools",
    "plenora.capability.version": "1",
    "plenora.capability.operation": "database.read",
    "plenora.operation.version": "1",
    "plenora.input.contract": "plenora-database-read-input-v1",
    "plenora.execution.deadline": "2030-01-01T00:00:00Z",
    "plenora.trace.correlation_id": "vector-database-read-1"
  },
  "payload": {
    "connection_ref": "secret://database/example",
    "provider": "postgres",
    "source": {"catalog": null, "schema": "public", "object": "example", "layer_id": null},
    "projection": ["id", "geometry"],
    "order_by": [],
    "row_limit": 100,
    "filter": null
  }
}
